{
  "schema_version": "0.1.1",
  "template_id": "atni-convention",
  "name": "ATNI Climate Convention Network",
  "description": "Template for the ATNI Climate convention pilot network (D-094c): people, the 15 standing ATNI Climate committees, and partner organizations, connected by committee membership, organizational affiliation, and declared person-to-person ties. FULLY SYNTHETIC fixture for the 2026-09-14 reveal - every person, organization, and tribe/affiliation name is fictional and every example contact value uses the @example.test namespace. The 15 committee names are the real, public ATNI Climate committee list; no committee-member data is real. Consent is enforced structurally at intake (D-030), not stored as a template attribute.",
  "vocabulary": {
    "entities": "committee members, organizations, and standing committees",
    "person": "member"
  },
  "kinds": [
    {
      "id": "person",
      "label": "Member",
      "shape": "sphere",
      "color_role": "kind-1",
      "attributes": [
        { "id": "display_name", "type": "text", "required": true, "default_visibility": "group" },
        { "id": "tribe", "type": "text", "default_visibility": "group" },
        { "id": "role", "type": "text", "default_visibility": "group" },
        { "id": "areas_of_interest", "type": "tags", "default_visibility": "group" },
        { "id": "specialties", "type": "tags", "default_visibility": "group" },
        { "id": "events_of_interest", "type": "tags", "default_visibility": "group" },
        { "id": "contact_email", "type": "link", "format": "email", "default_visibility": "trusted" },
        { "id": "contact_preference", "type": "enum", "values": ["email", "phone", "no-contact"], "default_visibility": "group" }
      ]
    },
    {
      "id": "committee",
      "label": "Committee",
      "shape": "torus",
      "color_role": "kind-2",
      "attributes": [
        { "id": "display_name", "type": "text", "required": true, "default_visibility": "public" }
      ]
    },
    {
      "id": "organization",
      "label": "Organization",
      "shape": "cube",
      "color_role": "kind-3",
      "attributes": [
        { "id": "display_name", "type": "text", "required": true, "default_visibility": "public" },
        { "id": "org_type", "type": "enum", "values": ["university", "agency", "tribal-nation", "ngo", "industry"], "default_visibility": "public" },
        { "id": "website", "type": "link", "default_visibility": "public" }
      ]
    }
  ],
  "edge_kinds": [
    { "id": "member_of", "label": "member of", "from": ["person"], "to": ["committee"], "directed": true },
    { "id": "affiliated_with", "label": "affiliated with", "from": ["person"], "to": ["organization"], "directed": true },
    { "id": "connected_to", "label": "connected to", "from": ["person"], "to": ["person"], "directed": false, "weighted": "optional" }
  ],
  "theme": {
    "mode": "default-dark",
    "roles": {
      "kind-1": "#56b4e9",
      "kind-2": "#009e73",
      "kind-3": "#e69f00"
    }
  }
}
